{
  "schemaVersion": 1,
  "reviewId": "REV-PREM-QNT-001-LEARNING-DESIGN-A0E36B8D",
  "lessonId": "PREM-QNT-001",
  "lessonVersion": "0.2.0",
  "candidateCommit": "8a45d4e9cc0be06bf94744f55de24910f48bde90",
  "role": "learning-design",
  "verdict": "approve",
  "reviewer": {
    "principalId": "github:VSBDev",
    "displayName": "VSBDev (learning-design reviewer)",
    "agent": {
      "system": "Agy",
      "provider": "Google",
      "model": "gemini-3.5-flash-high",
      "version": "Agy 1.1.6",
      "runId": "agy-learning-design-PREM-QNT-001-A0E36B8D-5A2D-45BC-AAEC-727EF8DC1BF6",
      "instructionsDigest": "sha256:373285463541969b9925c6f9677afc2b892a1dcc9607770df8ed094a1271e308"
    }
  },
  "conflictOfInterest": {
    "declared": true,
    "details": "Founding-stage isolation check: the accountable principal VSBDev operates the authoring, review, and finalization agents, so principal-level independence is absent. Agent-level role isolation was strictly maintained: no authoring history, other review output, or adjudication draft was read, and no other EmbeddedKnowledge role script was run during this review execution."
  },
  "evidenceChecked": [
    "lessons/PREM-QNT-001-estimate-calculate-check/lesson.json",
    "lessons/PREM-QNT-001-estimate-calculate-check/claims.json",
    "lessons/PREM-QNT-001-estimate-calculate-check/references.json",
    "lessons/PREM-QNT-001-estimate-calculate-check/glossary.json",
    "lessons/PREM-QNT-001-estimate-calculate-check/ATTRIBUTION.md",
    "lessons/PREM-QNT-001-estimate-calculate-check/content/010-orientation.md",
    "lessons/PREM-QNT-001-estimate-calculate-check/content/020-concept.md",
    "lessons/PREM-QNT-001-estimate-calculate-check/content/030-worked-example.md",
    "lessons/PREM-QNT-001-estimate-calculate-check/content/040-misconception.md",
    "lessons/PREM-QNT-001-estimate-calculate-check/content/050-practice.md",
    "lessons/PREM-QNT-001-estimate-calculate-check/content/060-transfer.md",
    "lessons/PREM-QNT-001-estimate-calculate-check/content/070-synthesis.md",
    "lessons/PREM-QNT-001-estimate-calculate-check/content/080-clinical-wrap-up.md",
    "lessons/PREM-QNT-001-estimate-calculate-check/assessment.json",
    "CONTENT-STANDARD.md"
  ],
  "findings": [
    {
      "severity": "minor",
      "target": "lessons/PREM-QNT-001-estimate-calculate-check/content/020-concept.md#L83",
      "finding": "There is a minor inconsistency in precision formatting and trailing zero usage between addition examples. In `020-concept.md` line 83, the result of adding 4.0 million and 30,000 is written keeping the trailing zero: `4.030 \\times 10^6` (from $4.0\\times10^6+0.030\\times10^6$). In contrast, in `050-practice.md` line 34, a similar addition is written dropping the trailing zero: `5.48 \\times 10^5` (from $5.4 + 0.080 = 5.480$), and `assessment.json` item `item-add-shared-scale` defines the correct response as `6.24 \\times 10^5` (dropping the zero from $6.2 + 0.040 = 6.240$).",
      "resolution": "Standardize trailing zero usage in addition results. Since significant figures are not formally taught in this lesson, dropping the trailing zero (e.g., `4.03 \\times 10^6`) is likely clearer for introductory students."
    },
    {
      "severity": "minor",
      "target": "lessons/PREM-QNT-001-estimate-calculate-check/content/050-practice.md#L1",
      "finding": "The scene title and header is '# Fade the scaffold'. The term 'scaffold' is learning-design jargon. According to the first-read gate in `CONTENT-STANDARD.md` (lines 77-88), internal project metadata and rubric terminology should not be exposed to learners. A more student-friendly title would improve clarity.",
      "resolution": "Change the scene title and main header to a student-friendly phrase, such as '# Guided practice' or '# Building independence'."
    },
    {
      "severity": "note",
      "target": "lessons/PREM-QNT-001-estimate-calculate-check/content/080-clinical-wrap-up.md",
      "finding": "The clinical wrap-up scene `080-clinical-wrap-up.md` provides an excellent, contextualized application of the estimate-calculate-challenge loop in medicine. The clear 'not medical advice' disclaimers keep it educational while framing calculations around the real-world consequence of catching scale errors before dosing.",
      "resolution": null
    },
    {
      "severity": "note",
      "target": "lessons/PREM-QNT-001-estimate-calculate-check/content/010-orientation.md#L3-L13",
      "finding": "First-read gate check: The lesson opener uses a concrete fictional particle counter scenario to raise a compelling scale check question, motivating the learner before introducing formal definitions or objectives. The introductory student can easily explain what the lesson is about and why it matters after one read.",
      "resolution": null
    }
  ],
  "limitations": [
    "Expert-simulation review: This review represents a single-pass advisory input by a simulated learning-design expert under standard-lesson-v3 guidelines. No real learner testing was conducted.",
    "Conflict of interest: The same GitHub principal (VSBDev) is responsible for the authoring and review run operators. Agent-level isolation was maintained, but principal-level independence is absent.",
    "Scope restriction: The review is property bounded to learning-design metrics (e.g., clarity, coherence, practice, alignment, and transfer). Scientific accuracy, rights audits, and final typesetting checks are excluded.",
    "Technical verification limits: No rendered build environment, screen reader, or keyboard navigation pathways were evaluated physically; findings are based solely on the static Markdown and JSON source files."
  ],
  "signedAt": "2026-07-24T21:40:00Z"
}
