{
  "schemaVersion": 1,
  "reviewId": "REV-PREM-QNT-009-7A824977-4D2D-4E2B-967B-A2EBFCF0811E",
  "lessonId": "PREM-QNT-009",
  "lessonVersion": "0.2.0",
  "candidateCommit": "ecef30b0584f5968b06bb7d5990fc379f2dbf77a",
  "role": "learning-design",
  "verdict": "approve",
  "reviewer": {
    "principalId": "github:VSBDev",
    "displayName": "VSBDev",
    "agent": {
      "system": "Agy",
      "provider": "Google",
      "model": "gemini-3.5-flash-high",
      "version": "Agy 1.1.6",
      "runId": "agy-learning-design-PREM-QNT-009-7A824977-4D2D-4E2B-967B-A2EBFCF0811E",
      "instructionsDigest": "sha256:9f2ff188399a1a7fe4124011b39ae74d3d3bb22754992179f08caa75151d17cc"
    }
  },
  "conflictOfInterest": {
    "declared": false,
    "details": null
  },
  "evidenceChecked": [
    "lessons/PREM-QNT-009-vectors-components/lesson.json",
    "lessons/PREM-QNT-009-vectors-components/claims.json",
    "lessons/PREM-QNT-009-vectors-components/glossary.json",
    "lessons/PREM-QNT-009-vectors-components/references.json",
    "lessons/PREM-QNT-009-vectors-components/ATTRIBUTION.md",
    "lessons/PREM-QNT-009-vectors-components/content/010-orientation.md",
    "lessons/PREM-QNT-009-vectors-components/content/020-concept.md",
    "lessons/PREM-QNT-009-vectors-components/content/030-worked-example.md",
    "lessons/PREM-QNT-009-vectors-components/content/040-misconception.md",
    "lessons/PREM-QNT-009-vectors-components/content/050-practice.md",
    "lessons/PREM-QNT-009-vectors-components/content/060-transfer.md",
    "lessons/PREM-QNT-009-vectors-components/content/070-synthesis.md",
    "lessons/PREM-QNT-009-vectors-components/content/080-clinical-wrap-up.md",
    "lessons/PREM-QNT-009-vectors-components/assessment.json"
  ],
  "findings": [
    {
      "severity": "note",
      "target": "lessons/PREM-QNT-009-vectors-components/glossary.json",
      "finding": "Verified glossary terms against premed-terminology.json. No collisions or shifts exist with earlier published lessons as these vector terms are new to the course.",
      "resolution": null
    },
    {
      "severity": "note",
      "target": "lessons/PREM-QNT-009-vectors-components/content/040-misconception.md",
      "finding": "The misconception scene successfully follows the required six-step repair sequence from CONTENT-STANDARD.md §7. It prompts active commitment and tests it with a recheck.",
      "resolution": null
    },
    {
      "severity": "note",
      "target": "lessons/PREM-QNT-009-vectors-components/content/080-clinical-wrap-up.md",
      "finding": "The new clinical wrap-up scene successfully provides a relevant transfer context (musculoskeletal bone forces) with accurate vector math, dot product alignment check, and compression/shear projections.",
      "resolution": null
    },
    {
      "severity": "minor",
      "target": "lessons/PREM-QNT-009-vectors-components/content/080-clinical-wrap-up.md",
      "finding": "The unit symbol 'N' (Newtons) is introduced in the check and feedback sections but is not explicitly defined. Per CONTENT-STANDARD.md §4.2, all unit abbreviations should be defined before or adjacent to first use.",
      "resolution": "Define 'N' as Newtons at its first occurrence in the clinical wrap-up check (e.g., 'Force A has magnitude 60 N (Newtons)...')."
    }
  ],
  "limitations": [
    "Review is limited to static analysis of the Markdown files and schema compliance; no real-user behavioral data or interactive software rendering outcomes were available.",
    "Academic accuracy and clinical boundaries are assumed to be validated by the respective quorum roles."
  ],
  "signedAt": "2026-07-24T21:03:50Z"
}
